{
  "candidate": {},
  "envelope_digest": "sha256:0000000000000000000000000000000000000000000000000000000000000000",
  "evidence_plan_digest": "sha256:0000000000000000000000000000000000000000000000000000000000000000",
  "evidence_refs": [],
  "finding_refs": [],
  "issued_at": "2026-08-08T00:00:00Z",
  "launch_id": "launch-1",
  "mission_id": "delivery-example",
  "outcome": "pass",
  "schema_version": 1,
  "scope": "final",
  "verdict_id": "verdict-1"
}
